<?xml version="1.0" encoding="UTF-8"?>
<!DOCTYPE mozi SYSTEM "../PHRO7R_0924/PHRO7R_mozi.dtd">
<mozi>
    <film id="txn_nxm_2jb" mufaj="horror">
        <rendezo id="nzk_4xm_2jb" nev="alex" />
        <szinesz id="u5g_4xm_2jb" nev="Madison_Ivy" />
        <szinesz id="a">
            <gyerekszinesz />
            <musicalszinesz />
            <szinkronszinesz />
        </szinesz>
        <iro id="trv_4xm_2jb" />
    </film>
    <film id="abc_2jb" mufaj="drama">
        <rendezo id="rnd_2jb">
            <vezetorendezo />
            <segedrendezo />
        </rendezo>
        <szinesz id="szin_2jb" nev="Kiss Anna" />
        <iro id="iro_2jb">
            <foiro />
            <tarsiro />
        </iro>
    </film>
</mozi>